{
  "contentBindings": [
    {
      "recordCanonicalSha256": "1f87aad226654023f56866908a0efd4a698f8b4bdc2b925151b2a84140af5b76",
      "recordId": "EVAL-T08-API-01",
      "reviewId": "IR-T08",
      "sourcePath": "assets/t08-validation-errors.json"
    },
    {
      "recordCanonicalSha256": "377cbfb179c2055a247f1cc4c40024f438b2c8aa1f96521367cea6ccaf861006",
      "recordId": "EVAL-T19-WEBHOOK-01",
      "reviewId": "IR-T19",
      "sourcePath": "assets/t19-webhooks.json"
    },
    {
      "recordCanonicalSha256": "29fb9ec38537e450a444c811a391fef00b9faa2d0d386633471d1aa2f9db9623",
      "recordId": "EVAL-T21-IMPORT-01",
      "reviewId": "IR-T21",
      "sourcePath": "assets/t21-hostile-imports.json"
    },
    {
      "recordCanonicalSha256": "996eb75c856900fb04834c2321cc8176f71e22ffde3927e0eb40da8ba4ee8c11",
      "recordId": "EVAL-T25-USABILITY-01",
      "reviewId": "IR-T25",
      "sourcePath": "assets/t25-usability-protocol.json"
    },
    {
      "recordCanonicalSha256": "c349af06433e4a64476e71001b0370311ae1a5c7444165fff0007aaa0d42e29e",
      "recordId": "EVAL-FIXCOV-T01",
      "reviewId": "IR-LEGACY-SEMANTIC",
      "sourcePath": "coverage/fixture-coverage.json"
    },
    {
      "recordCanonicalSha256": "7fc8f0d75f2c13942646ad7aa8344898e0c62d0abeed83ebb9667dfb996ee701",
      "recordId": "EVAL-FIXCOV-T02",
      "reviewId": "IR-LEGACY-SEMANTIC",
      "sourcePath": "coverage/fixture-coverage.json"
    },
    {
      "recordCanonicalSha256": "b20e609f23ea57a4c2af2865888fc54599515141281973e8892fe5e2ec84c918",
      "recordId": "EVAL-FIXCOV-T03",
      "reviewId": "IR-LEGACY-SEMANTIC",
      "sourcePath": "coverage/fixture-coverage.json"
    },
    {
      "recordCanonicalSha256": "65b4de4ee51fa7f56f57d47463f153d5cdec320edaa89ff6af7a8da43a0c6465",
      "recordId": "EVAL-FIXCOV-T04",
      "reviewId": "IR-LEGACY-SEMANTIC",
      "sourcePath": "coverage/fixture-coverage.json"
    },
    {
      "recordCanonicalSha256": "b75233b73770c1967c9fa92e72bfcddb4d58625041702c6a62570b4a24812d20",
      "recordId": "EVAL-FIXCOV-T05",
      "reviewId": "IR-LEGACY-SEMANTIC",
      "sourcePath": "coverage/fixture-coverage.json"
    },
    {
      "recordCanonicalSha256": "09de52f769c441f727aef1f5f5d4ad79252aa62021e67f2cf111b31eae2277d9",
      "recordId": "EVAL-FIXCOV-T06",
      "reviewId": "IR-LEGACY-SEMANTIC",
      "sourcePath": "coverage/fixture-coverage.json"
    },
    {
      "recordCanonicalSha256": "4f4d126d5fa71585b7c05f0fb631bb461629cac62e4d9214d778248efb3846f3",
      "recordId": "EVAL-FIXCOV-T07",
      "reviewId": "IR-LEGACY-SEMANTIC",
      "sourcePath": "coverage/fixture-coverage.json"
    },
    {
      "recordCanonicalSha256": "77bcbab7965515bedf107a52eaa50e12860813d4011ea9334f4686ff4e481417",
      "recordId": "EVAL-FIXCOV-T08",
      "reviewId": "IR-LEGACY-SEMANTIC",
      "sourcePath": "coverage/fixture-coverage.json"
    },
    {
      "recordCanonicalSha256": "c1c75242e0caa4de4293241e80a72580b43f94c41101cff5796d8de7f5af1352",
      "recordId": "EVAL-FIXCOV-T09",
      "reviewId": "IR-LEGACY-SEMANTIC",
      "sourcePath": "coverage/fixture-coverage.json"
    },
    {
      "recordCanonicalSha256": "8edd45ca3b4c062546921dd8b71a27e35a705fac447f7ab2174c937a6ccb66bf",
      "recordId": "EVAL-FIXCOV-T10",
      "reviewId": "IR-LEGACY-SEMANTIC",
      "sourcePath": "coverage/fixture-coverage.json"
    },
    {
      "recordCanonicalSha256": "6373ce745e7499bae4e7b5e3873d93537c93999b557e53b095f407435b6bd800",
      "recordId": "EVAL-FIXCOV-T11",
      "reviewId": "IR-LEGACY-SEMANTIC",
      "sourcePath": "coverage/fixture-coverage.json"
    },
    {
      "recordCanonicalSha256": "6bdf54d07edb5eb36b6e13135aa8ebdb92beb801b913682c22adb47d392c9e11",
      "recordId": "EVAL-FIXCOV-T12",
      "reviewId": "IR-LEGACY-SEMANTIC",
      "sourcePath": "coverage/fixture-coverage.json"
    },
    {
      "recordCanonicalSha256": "34aff2101a272adc96c32f224841f4d0e9f9717a46438a3daa749c1c08a7972a",
      "recordId": "EVAL-FIXCOV-T13",
      "reviewId": "IR-LEGACY-SEMANTIC",
      "sourcePath": "coverage/fixture-coverage.json"
    },
    {
      "recordCanonicalSha256": "6d212e4645828e2586123578d3e9b502b6412fdf996afdefe23cc11fa0b9927b",
      "recordId": "EVAL-FIXCOV-T14",
      "reviewId": "IR-LEGACY-SEMANTIC",
      "sourcePath": "coverage/fixture-coverage.json"
    },
    {
      "recordCanonicalSha256": "9122cfa5e1b6641e86dba264fcac639cc537d68903bb6b183317ce444a1f414c",
      "recordId": "EVAL-FIXCOV-T15",
      "reviewId": "IR-LEGACY-SEMANTIC",
      "sourcePath": "coverage/fixture-coverage.json"
    },
    {
      "recordCanonicalSha256": "661ee757e046d03a3fe3b9deaf975e00a4375693c5164ef233f9b9607f92ecd7",
      "recordId": "EVAL-FIXCOV-T17",
      "reviewId": "IR-LEGACY-SEMANTIC",
      "sourcePath": "coverage/fixture-coverage.json"
    },
    {
      "recordCanonicalSha256": "8ea8a43727dd2c44afd2d79aa7652b934a7cfe5444d860f6f8b7f3ba29c644c0",
      "recordId": "EVAL-FIXCOV-T18",
      "reviewId": "IR-LEGACY-SEMANTIC",
      "sourcePath": "coverage/fixture-coverage.json"
    },
    {
      "recordCanonicalSha256": "d084ef2ab0acc4b79f001a468aa7ce6085ae77f253bb85379890ac92afbcb083",
      "recordId": "EVAL-FIXCOV-T19",
      "reviewId": "IR-LEGACY-SEMANTIC",
      "sourcePath": "coverage/fixture-coverage.json"
    },
    {
      "recordCanonicalSha256": "5a8444e5cf7051c9685bac01c61b62bf4ea22d4ec2b3c29f4b03431f8aed2adb",
      "recordId": "EVAL-FIXCOV-T20",
      "reviewId": "IR-LEGACY-SEMANTIC",
      "sourcePath": "coverage/fixture-coverage.json"
    },
    {
      "recordCanonicalSha256": "1730c0661becda914deb4ff6ed60be390504ae4cb76d12a516cb433f8162ecea",
      "recordId": "EVAL-FIXCOV-T21",
      "reviewId": "IR-LEGACY-SEMANTIC",
      "sourcePath": "coverage/fixture-coverage.json"
    },
    {
      "recordCanonicalSha256": "2708fcf230e5ab127726692737b39245b99c9d1619a13c754fefd818320d391b",
      "recordId": "EVAL-FIXCOV-T22",
      "reviewId": "IR-LEGACY-SEMANTIC",
      "sourcePath": "coverage/fixture-coverage.json"
    },
    {
      "recordCanonicalSha256": "a975f878fc1e5cf84a27095c498d4ec5ef7b83aae91550a27ac4d574e54d35b2",
      "recordId": "EVAL-FIXCOV-T23",
      "reviewId": "IR-LEGACY-SEMANTIC",
      "sourcePath": "coverage/fixture-coverage.json"
    },
    {
      "recordCanonicalSha256": "71ddba5d7200179d87272c37cefc5a30fd7ced24b3a8855b13ce08cbd33170f5",
      "recordId": "EVAL-FIXCOV-T24",
      "reviewId": "IR-LEGACY-SEMANTIC",
      "sourcePath": "coverage/fixture-coverage.json"
    },
    {
      "recordCanonicalSha256": "ea4c4df36d81626af02b51f65770911664634f0c5a1cd4dfcb2caf77ecb4cddd",
      "recordId": "EVAL-FIXCOV-T25",
      "reviewId": "IR-LEGACY-SEMANTIC",
      "sourcePath": "coverage/fixture-coverage.json"
    },
    {
      "recordCanonicalSha256": "57993f2ce253ce4fc5573d34526cddd4922ebddc5b350fb9b5e9fdb9a91090dd",
      "recordId": "EVAL-FIXCOV-T26",
      "reviewId": "IR-LEGACY-SEMANTIC",
      "sourcePath": "coverage/fixture-coverage.json"
    },
    {
      "recordCanonicalSha256": "b4ae3dcb4fbcd85e03c029b5640742380f70738223abf950eed1b2b3752d514a",
      "recordId": "EVAL-FIXCOV-T27",
      "reviewId": "IR-LEGACY-SEMANTIC",
      "sourcePath": "coverage/fixture-coverage.json"
    },
    {
      "recordCanonicalSha256": "18fbeea9a0a2e888bf3a2d6d098e2f5cfcf4428331da627ab556632f5d05069d",
      "recordId": "EVAL-FIXCOV-T28",
      "reviewId": "IR-LEGACY-SEMANTIC",
      "sourcePath": "coverage/fixture-coverage.json"
    },
    {
      "recordCanonicalSha256": "6b353f89eee3f2ec83fc6947087c36ec864c8e5f705f15afbdf0fd37d43a3bb2",
      "recordId": "EVAL-FIXCOV-T29",
      "reviewId": "IR-LEGACY-SEMANTIC",
      "sourcePath": "coverage/fixture-coverage.json"
    },
    {
      "recordCanonicalSha256": "87da2ccf4d6661ba1f0113aff46ac68a3ec89b5a57bae9bc474c38db49d36202",
      "recordId": "EVAL-FIXCOV-T30",
      "reviewId": "IR-LEGACY-SEMANTIC",
      "sourcePath": "coverage/fixture-coverage.json"
    },
    {
      "recordCanonicalSha256": "1a7ea9c487b80328b6e53c8f25a8ff6c2e1bd4dbd895c269c5ccbf2302aad7c8",
      "recordId": "EVAL-FIXCOV-T31",
      "reviewId": "IR-LEGACY-SEMANTIC",
      "sourcePath": "coverage/fixture-coverage.json"
    },
    {
      "recordCanonicalSha256": "7fb674ea27eac2093ceb86371feb955acf7909b8b407cc521938467e3e13a09d",
      "recordId": "EVAL-FIXCOV-T32",
      "reviewId": "IR-LEGACY-SEMANTIC",
      "sourcePath": "coverage/fixture-coverage.json"
    },
    {
      "recordCanonicalSha256": "c1862d8d3d53a5c02916ce4ca799d0b35055537f68f195a8581c49e8f79e6a4b",
      "recordId": "EVAL-LOC-INVALID-01",
      "reviewId": "IR-LEGACY-SEMANTIC",
      "sourcePath": "locales/invalid-variant.json"
    },
    {
      "recordCanonicalSha256": "78c5b9d3dda348a94f1c730dc941c4a53dc4400e3322d53db5b2f8cad54977b4",
      "recordId": "EVAL-LOC-INVALID-02",
      "reviewId": "IR-LEGACY-SEMANTIC",
      "sourcePath": "locales/invalid-variant.json"
    },
    {
      "recordCanonicalSha256": "808f0a9880b0b0467c1c2504c53f83cb91b5aabc10cb5e3074cadebd9bc32456",
      "recordId": "EVAL-LOC-KEY-01",
      "reviewId": "IR-LEGACY-SEMANTIC",
      "sourcePath": "locales/key-inventory.json"
    },
    {
      "recordCanonicalSha256": "5b53cb3bbdb2a9dd24e58e3aa39e449610972dfd61996bbb7b209b22c7d2255d",
      "recordId": "EVAL-LOC-KEY-02",
      "reviewId": "IR-LEGACY-SEMANTIC",
      "sourcePath": "locales/key-inventory.json"
    },
    {
      "recordCanonicalSha256": "2f3e7465d3944a65ff0fb90759cc4e04c31c78939afa6465f5dc8260437a612b",
      "recordId": "EVAL-LOC-KEY-03",
      "reviewId": "IR-LEGACY-SEMANTIC",
      "sourcePath": "locales/key-inventory.json"
    },
    {
      "recordCanonicalSha256": "9da6f3eaff8bed191075e869da56915955033a211e11f88d3f61d0ad7593d541",
      "recordId": "EVAL-LOC-KEY-04",
      "reviewId": "IR-LEGACY-SEMANTIC",
      "sourcePath": "locales/key-inventory.json"
    },
    {